[
  {
    "image_filename": "cozy_vintage_squirrel_coffee_and_hotdog_cabin_design.png",
    "title": "Cozy Vintage Squirrel Coffee and Hotdog Cabin Design",
    "main_tag": "funny squirrel coffee",
    "supporting_tags": [
      "cozy squirrel",
      "squirrel lovers gift",
      "coffee addicted animal",
      "flooded cabin scene",
      "vintage coffee aesthetic",
      "humorous animal merch",
      "cottagecore squirrel",
      "coffee break aesthetic",
      "hotdog eating squirrel",
      "quirky nature design",
      "coffee and squirrel",
      "retro woodland art",
      "vintage squirrel illustration"
    ],
    "tags": [
      "funny squirrel coffee",
      "cozy squirrel",
      "squirrel lovers gift",
      "coffee addicted animal",
      "flooded cabin scene",
      "vintage coffee aesthetic",
      "humorous animal merch",
      "cottagecore squirrel",
      "coffee break aesthetic",
      "hotdog eating squirrel",
      "quirky nature design",
      "coffee and squirrel",
      "retro woodland art",
      "vintage squirrel illustration"
    ],
    "description": "An endearing vintage graphic featuring a clever squirrel wearing round glasses inside a flooded cozy wooden cabin. The squirrel enjoys a hot cup of coffee and a warm hotdog, surrounded by coffee roasting machinery, jars of acorn relish, and submerged books. Outside the window lies a peaceful countryside landscape, bringing warmth to the whimsical indoor scene. Framed with an ornate botanical border featuring coffee beans, paw prints, and acorn flourishes, this detailed artwork is ideal for t-shirts, mugs, and merch.",
    "background_color": "#000000",
    "is_mature": "No",
    "is_public": "Public",
    "enable_all_products": "Yes"
  }
]