[
  {
    "image_filename": "golden_retriever_coffee_lover_cozy_flooded_cafe_vintage_design.png",
    "title": "Golden Retriever Coffee Lover Cozy Flooded Cafe Vintage Design",
    "main_tag": "golden retriever coffee lover",
    "supporting_tags": [
      "funny dog coffee lover",
      "golden retriever wearing glasses",
      "cozy flooded cafe design",
      "dog owner gift merch",
      "vintage coffee house dog",
      "cute retriever with coffee mug",
      "morning coffee dog graphic",
      "retro pet lover t-shirt",
      "canine coffee roaster art",
      "flooded cabin coffee break",
      "golden retriever illustration"
    ],
    "tags": [
      "golden retriever coffee lover",
      "funny dog coffee lover",
      "golden retriever wearing glasses",
      "cozy flooded cafe design",
      "dog owner gift merch",
      "vintage coffee house dog",
      "cute retriever with coffee mug",
      "morning coffee dog graphic",
      "retro pet lover t-shirt",
      "canine coffee roaster art",
      "flooded cabin coffee break",
      "golden retriever illustration"
    ],
    "description": "A charming retro-style artwork depicting a cheerful Golden Retriever wearing round spectacles and enjoying a steaming cup of morning coffee. The dog stands waist-deep in water inside a flooded, rustic coffee shop complete with an espresso roaster, books, and coffee bean sacks. A large window offers a beautiful view of a tranquil countryside landscape framed by a ornate floral border with paw prints. This humorous and cozy graphic illustration makes a fantastic print for t-shirts, mugs, and pet lovers merch.",
    "background_color": "#000000",
    "is_mature": "No",
    "is_public": "Public",
    "enable_all_products": "Yes"
  }
]