[
  {
    "image_filename": "cozy_red_dragon_coffee_roaster_vintage_fantasy_merch_design.png",
    "title": "Cozy Red Dragon Coffee Roaster Vintage Fantasy Merch Design",
    "main_tag": "dragon coffee roaster",
    "supporting_tags": [
      "fantasy coffee shirt",
      "cozy red dragon",
      "steampunk coffee roaster",
      "coffee lover merch",
      "mythical dragon barista",
      "lava roast cafe",
      "vintage fantasy art",
      "coffee dragon design",
      "bookish dragon aesthetic",
      "cute fantasy t-shirt",
      "cozy cave brew",
      "fantasy graphic illustration",
      "coffee dragon logo"
    ],
    "tags": [
      "dragon coffee roaster",
      "fantasy coffee shirt",
      "cozy red dragon",
      "steampunk coffee roaster",
      "coffee lover merch",
      "mythical dragon barista",
      "lava roast cafe",
      "vintage fantasy art",
      "coffee dragon design",
      "bookish dragon aesthetic",
      "cute fantasy t-shirt",
      "cozy cave brew",
      "fantasy graphic illustration",
      "coffee dragon logo"
    ],
    "description": "A charming and detailed fantasy scene depicting a red dragon wearing reading glasses as it brews coffee with a vintage steampunk roasting machine inside a subterranean cave studio. Warm lava channels flow beneath the stone floor while the dragon holds a steaming mug, surrounded by rustic shelves stocked with jars labeled Sulfur Spice and Lava Roast, old books, and a bowl of dragon eggs. An arched stone window opens to a distant mountain castle standing against the morning sun. The artwork is beautifully framed by an elaborate decorative border featuring coffee berries, leaves, paw prints, and baked pastries.",
    "background_color": "#000000",
    "is_mature": "No",
    "is_public": "Public",
    "enable_all_products": "Yes"
  }
]