[
  {
    "image_filename": "cute_hamster_explorer_african_savanna_safari_adventure_graphic_design.png",
    "title": "Cute Hamster Explorer African Savanna Safari Adventure Graphic Design",
    "main_tag": "cute hamster explorer",
    "supporting_tags": [
      "savanna safari adventure",
      "african wildlife graphic",
      "cute animal explorer",
      "hamster safari shirt",
      "elephant giraffe meerkats",
      "funny hamster design",
      "wilderness safari tour",
      "wild animal adventure",
      "kids safari graphic",
      "cute safari merch",
      "nature lover design",
      "whimsical animal illustration"
    ],
    "tags": [
      "cute hamster explorer",
      "savanna safari adventure",
      "african wildlife graphic",
      "cute animal explorer",
      "hamster safari shirt",
      "elephant giraffe meerkats",
      "funny hamster design",
      "wilderness safari tour",
      "wild animal adventure",
      "kids safari graphic",
      "cute safari merch",
      "nature lover design",
      "whimsical animal illustration"
    ],
    "description": "A cute hamster wearing a backpack and holding a magnifying glass embarks on a whimsical savanna safari adventure. Surrounding the adventurous tiny explorer are friendly wild animals, including an elephant interacting with a butterfly, a giraffe peeking through the foliage, curious meerkats, and a friendly crocodile in a pond. Set under a bright sunny sky with tall acacia trees and golden grass, this charming scene makes a delightful shirt graphic for wildlife enthusiasts.",
    "background_color": "#000000",
    "is_mature": "No",
    "is_public": "Public",
    "enable_all_products": "Yes"
  }
]