[
  {
    "image_filename": "roaring_tiger_in_dynamic_motion.png",
    "title": "Roaring Tiger in Dynamic Motion",
    "main_tag": "tiger art",
    "supporting_tags": [
      "animal illustration",
      "wildlife graphic",
      "tiger design",
      "fierce tiger",
      "tiger face",
      "animal print",
      "tiger graphic",
      "tiger poster",
      "tiger merchandise",
      "tiger apparel",
      "tiger artwork",
      "tiger vector",
      "tiger emblem",
      "tiger logo"
    ],
    "tags": [
      "tiger art",
      "animal illustration",
      "wildlife graphic",
      "tiger design",
      "fierce tiger",
      "tiger face",
      "animal print",
      "tiger graphic",
      "tiger poster",
      "tiger merchandise",
      "tiger apparel",
      "tiger artwork",
      "tiger vector",
      "tiger emblem",
      "tiger logo"
    ],
    "description": "The image features a highly stylized, roaring tiger with a fierce expression, depicted in a bold, graphic art style. The tiger's fur is rendered in vibrant shades of orange and black, with white accents highlighting its facial features and underbelly. Its eyes are narrowed, and its mouth is wide open, showcasing sharp teeth, conveying a sense of power and aggression. The background is a solid dark color, which makes the tiger's colors pop, and there are streaks of orange that suggest movement and energy. The composition focuses on the tiger's face and upper body, with its paw extended forward, enhancing the dynamic feel of the artwork.",
    "background_color": "#000000",
    "is_mature": "No",
    "is_public": "Public",
    "enable_all_products": "Yes"
  }
]