[
  {
    "image_filename": "cozy_vintage_squirrel_drinking_coffee_in_flooded_cabin_t-shirt_design.png",
    "title": "Cozy Vintage Squirrel Drinking Coffee in Flooded Cabin T-Shirt Design",
    "main_tag": "cozy squirrel coffee",
    "supporting_tags": [
      "funny squirrel tshirt design",
      "vintage squirrel aesthetic",
      "coffee lover squirrel art",
      "hot dog and coffee graphics",
      "flooded cabin cozy vibes",
      "anthropomorphic animal art",
      "quirky squirrel tshirt print",
      "this is fine meme aesthetic",
      "acorn coffee roaster design",
      "cute forest animal merchandise",
      "retro storybook squirrel",
      "vintage coffee house t shirt",
      "whimsical animal illustration"
    ],
    "tags": [
      "cozy squirrel coffee",
      "funny squirrel tshirt design",
      "vintage squirrel aesthetic",
      "coffee lover squirrel art",
      "hot dog and coffee graphics",
      "flooded cabin cozy vibes",
      "anthropomorphic animal art",
      "quirky squirrel tshirt print",
      "this is fine meme aesthetic",
      "acorn coffee roaster design",
      "cute forest animal merchandise",
      "retro storybook squirrel",
      "vintage coffee house t shirt",
      "whimsical animal illustration"
    ],
    "description": "A whimsical vintage artwork featuring an anthropomorphic squirrel wearing round glasses, sitting relaxed in a flooded wooden cabin while enjoying a hot dog and a steamy cup of coffee. Beside the squirrel, a rustic countertop displays a coffee roasting machine, a basket of hot dogs, and jars labeled Squirrel's Stash and Acorn Relish. A scenic window view reveals a peaceful country cottage set against evergreen trees and rolling hills. Enclosed in an ornate botanical frame with acorns, coffee beans, and paw prints, this graphic brings a funny, cozy storybook charm to any apparel or merchandise collection.",
    "background_color": "#000000",
    "is_mature": "No",
    "is_public": "Public",
    "enable_all_products": "Yes"
  }
]