[
  {
    "image_filename": "golden_retriever_barista_drinking_coffee_flooded_cozy_cabin_roastery_graphic.png",
    "title": "golden retriever barista drinking coffee flooded cozy cabin roastery graphic",
    "main_tag": "golden retriever coffee",
    "supporting_tags": [
      "dog barista shirt",
      "cozy coffee lover dog",
      "dog drinking coffee",
      "funny dog shirt design",
      "coffee roaster dog",
      "flooded room coffee dog",
      "golden retriever in glasses",
      "vintage coffee aesthetic",
      "dog lover merch",
      "cafe retriever graphic",
      "cozy cabin dog art",
      "dog coffee shop design",
      "vintage dog illustration"
    ],
    "tags": [
      "golden retriever coffee",
      "dog barista shirt",
      "cozy coffee lover dog",
      "dog drinking coffee",
      "funny dog shirt design",
      "coffee roaster dog",
      "flooded room coffee dog",
      "golden retriever in glasses",
      "vintage coffee aesthetic",
      "dog lover merch",
      "cafe retriever graphic",
      "cozy cabin dog art",
      "dog coffee shop design",
      "vintage dog illustration"
    ],
    "description": "A charming vintage-style graphic featuring a cheerful Golden Retriever wearing round eyeglasses, holding a steaming mug of hot coffee while standing in a flooded wooden cabin coffee shop. Beside the dog, a retro espresso machine and coffee beans rest on a wooden table, with steam swirling into the cozy room. Through the background window, a serene countryside scene with mountains and a small cottage is visible under a warm sunset. The circular framed design is embellished with coffee beans, botanical leaves, paw prints, and dog bones, making it a perfect artwork for dog lovers and coffee enthusiasts.",
    "background_color": "#000000",
    "is_mature": "No",
    "is_public": "Public",
    "enable_all_products": "Yes"
  }
]