[
  {
    "image_filename": "cozy_whale_drinking_fresh_coffee_vintage_nautical_coastal_cabin_design.png",
    "title": "Cozy Whale Drinking Fresh Coffee Vintage Nautical Coastal Cabin Design",
    "main_tag": "coffee whale",
    "supporting_tags": [
      "nautical coffee",
      "cozy ocean aesthetic",
      "vintage coffee lover",
      "sea creature t-shirt",
      "coastal cabin design",
      "coffee roaster graphic",
      "lighthouse ocean view",
      "funny coffee lover gift",
      "whale drinking coffee",
      "vintage coffee shop illustration"
    ],
    "tags": [
      "coffee whale",
      "nautical coffee",
      "cozy ocean aesthetic",
      "vintage coffee lover",
      "sea creature t-shirt",
      "coastal cabin design",
      "coffee roaster graphic",
      "lighthouse ocean view",
      "funny coffee lover gift",
      "whale drinking coffee",
      "vintage coffee shop illustration"
    ],
    "description": "An ornate vintage style scene depicts a distinguished whale wearing glasses inside a flooded rustic cabin while holding a steaming mug of hot coffee. The warm wooden interior is filled with coffee beans, brewing machines, and books alongside a large window overlooking a coastal lighthouse at sunset. A decorative circular frame adorned with coffee leaves and cherries encircles this charming nautical aesthetic. Perfect for coffee lovers, sea enthusiasts, and unique apparel prints.",
    "background_color": "#000000",
    "is_mature": "No",
    "is_public": "Public",
    "enable_all_products": "Yes"
  }
]