[
  {
    "image_filename": "retro_pink_and_white_tiger_portrait_graphic.png",
    "title": "Retro Pink and White Tiger Portrait Graphic",
    "main_tag": "white tiger",
    "supporting_tags": [
      "pink tiger stripes",
      "retro tiger graphic",
      "t-shirt design",
      "merchandise art",
      "pop art tiger",
      "animal face print",
      "wild cat graphic",
      "blue and pink aesthetic",
      "streetwear graphic",
      "tiger face illustration",
      "cool animal logo"
    ],
    "tags": [
      "white tiger",
      "pink tiger stripes",
      "retro tiger graphic",
      "t-shirt design",
      "merchandise art",
      "pop art tiger",
      "animal face print",
      "wild cat graphic",
      "blue and pink aesthetic",
      "streetwear graphic",
      "tiger face illustration",
      "cool animal logo"
    ],
    "description": "A bold retro-style graphic featuring a stylized white tiger face with striking pink stripes. Centered on a vivid blue background, the minimalist design highlights the tiger's intense gaze and clean black whiskers, perfect for vibrant streetwear merch.",
    "background_color": "#000000",
    "is_mature": "No",
    "is_public": "Public",
    "enable_all_products": "Yes"
  }
]