[
  {
    "image_filename": "stylized_roaring_tiger_graphic_design.png",
    "title": "Stylized Roaring Tiger Graphic Design",
    "main_tag": "tiger graphic design",
    "supporting_tags": [
      "roaring tiger art",
      "animal print design",
      "wildlife illustration",
      "tiger face art",
      "animal graphic tee",
      "tiger artwork",
      "animal print t-shirt",
      "wildlife graphic",
      "tiger illustration",
      "animal print pattern",
      "tiger design",
      "animal print merchandise",
      "tiger graphic tee",
      "animal print logo"
    ],
    "tags": [
      "tiger graphic design",
      "roaring tiger art",
      "animal print design",
      "wildlife illustration",
      "tiger face art",
      "animal graphic tee",
      "tiger artwork",
      "animal print t-shirt",
      "wildlife graphic",
      "tiger illustration",
      "animal print pattern",
      "tiger design",
      "animal print merchandise",
      "tiger graphic tee",
      "animal print logo"
    ],
    "description": "The image features a dynamic and stylized depiction of a tiger in a roaring pose, with its mouth wide open revealing sharp teeth. The tiger's fur is rendered in a bold, graphic manner with a limited color palette dominated by orange, black, and white, accented with hints of blue and green. The background is a solid, muted brown, which contrasts with the tiger's vibrant colors and helps to make the subject stand out. The tiger's eyes are a striking blue, adding to the intensity of the expression. The overall style is modern and could be used for various merchandise, such as t-shirts, posters, or other graphic designs.",
    "background_color": "#000000",
    "is_mature": "No",
    "is_public": "Public",
    "enable_all_products": "Yes"
  }
]