[
  {
    "image_filename": "fierce_roaring_tiger_in_dynamic_motion.png",
    "title": "Fierce Roaring Tiger in Dynamic Motion",
    "main_tag": "fierce tiger",
    "supporting_tags": [
      "roaring tiger",
      "dynamic tiger",
      "tiger illustration",
      "animal art",
      "wildlife design",
      "tiger graphic",
      "animal print",
      "tiger artwork",
      "animal poster",
      "tiger design",
      "animal illustration",
      "tiger poster",
      "animal graphic",
      "tiger art"
    ],
    "tags": [
      "fierce tiger",
      "roaring tiger",
      "dynamic tiger",
      "tiger illustration",
      "animal art",
      "wildlife design",
      "tiger graphic",
      "animal print",
      "tiger artwork",
      "animal poster",
      "tiger design",
      "animal illustration",
      "tiger poster",
      "animal graphic",
      "tiger art"
    ],
    "description": "The image features a stylized, roaring tiger with a powerful stance, depicted in a bold, graphic art style. The tiger's fur is rendered with a gradient of orange, black, and white, highlighting its muscular build and fierce expression. The background is a solid, warm orange, which complements the tiger's color palette and adds to the intensity of the scene. The tiger's eyes are focused and its mouth is open, showcasing its sharp teeth, while its claws are extended, suggesting movement and strength. The overall composition is centered on the tiger, with no other elements to distract from its commanding presence.",
    "background_color": "#000000",
    "is_mature": "No",
    "is_public": "Public",
    "enable_all_products": "Yes"
  }
]