[
  {
    "image_filename": "roaring_tiger_illustration.png",
    "title": "Roaring_Tiger_Illustration",
    "main_tag": "roaring tiger",
    "supporting_tags": [
      "tiger illustration",
      "wild animal",
      "fierce tiger",
      "orange tiger",
      "striped tiger",
      "tiger art",
      "animal print",
      "tiger shirt design",
      "tiger merch",
      "tiger graphic",
      "tiger logo",
      "tiger poster",
      "tiger wall art",
      "tiger illustration"
    ],
    "tags": [
      "roaring tiger",
      "tiger illustration",
      "wild animal",
      "fierce tiger",
      "orange tiger",
      "striped tiger",
      "tiger art",
      "animal print",
      "tiger shirt design",
      "tiger merch",
      "tiger graphic",
      "tiger logo",
      "tiger poster",
      "tiger wall art",
      "tiger illustration"
    ],
    "description": "A dynamic, full-body illustration of a fierce tiger lunging forward, its mouth open in a roar, showcasing sharp teeth and intense yellow eyes. The tiger’s orange fur with bold black stripes is rendered in a stylized, graphic style with strong outlines and vibrant color gradients. The composition centers the animal against a plain white background, emphasizing its powerful stance and forward motion. The artwork is designed for t‑shirt and merch applications, combining bold visual impact with a classic wildlife motif.",
    "background_color": "#000000",
    "is_mature": "No",
    "is_public": "Public",
    "enable_all_products": "Yes"
  }
]