[
  {
    "image_filename": "cozy_red_dragon_coffee_roaster_vintage_fantasy_merch_design.png",
    "title": "Cozy Red Dragon Coffee Roaster Vintage Fantasy Merch Design",
    "main_tag": "dragon coffee roaster",
    "supporting_tags": [
      "fantasy coffee shirt",
      "cozy red dragon",
      "steampunk coffee roaster",
      "coffee lover merch",
      "mythical dragon barista",
      "lava roast cafe",
      "vintage fantasy art",
      "coffee dragon design",
      "bookish dragon aesthetic",
      "cute fantasy t-shirt",
      "cozy cave brew",
      "fantasy graphic illustration",
      "coffee dragon logo"
    ],
    "tags": [
      "dragon coffee roaster",
      "fantasy coffee shirt",
      "cozy red dragon",
      "steampunk coffee roaster",
      "coffee lover merch",
      "mythical dragon barista",
      "lava roast cafe",
      "vintage fantasy art",
      "coffee dragon design",
      "bookish dragon aesthetic",
      "cute fantasy t-shirt",
      "cozy cave brew",
      "fantasy graphic illustration",
      "coffee dragon logo"
    ],
    "description": "A charming and detailed fantasy scene depicting a red dragon wearing reading glasses as it brews coffee with a vintage steampunk roasting machine inside a subterranean cave studio. Warm lava channels flow beneath the stone floor while the dragon holds a steaming mug, surrounded by rustic shelves stocked with jars labeled Sulfur Spice and Lava Roast, old books, and a bowl of dragon eggs. An arched stone window opens to a distant mountain castle standing against the morning sun. The artwork is beautifully framed by an elaborate decorative border featuring coffee berries, leaves, paw prints, and baked pastries.",
    "background_color": "#000000",
    "is_mature": "No",
    "is_public": "Public",
    "enable_all_products": "Yes"
  },
  {
    "image_filename": "cozy_vintage_squirrel_drinking_coffee_in_flooded_cabin_t-shirt_design.png",
    "title": "Cozy Vintage Squirrel Drinking Coffee in Flooded Cabin T-Shirt Design",
    "main_tag": "cozy squirrel coffee",
    "supporting_tags": [
      "funny squirrel tshirt design",
      "vintage squirrel aesthetic",
      "coffee lover squirrel art",
      "hot dog and coffee graphics",
      "flooded cabin cozy vibes",
      "anthropomorphic animal art",
      "quirky squirrel tshirt print",
      "this is fine meme aesthetic",
      "acorn coffee roaster design",
      "cute forest animal merchandise",
      "retro storybook squirrel",
      "vintage coffee house t shirt",
      "whimsical animal illustration"
    ],
    "tags": [
      "cozy squirrel coffee",
      "funny squirrel tshirt design",
      "vintage squirrel aesthetic",
      "coffee lover squirrel art",
      "hot dog and coffee graphics",
      "flooded cabin cozy vibes",
      "anthropomorphic animal art",
      "quirky squirrel tshirt print",
      "this is fine meme aesthetic",
      "acorn coffee roaster design",
      "cute forest animal merchandise",
      "retro storybook squirrel",
      "vintage coffee house t shirt",
      "whimsical animal illustration"
    ],
    "description": "A whimsical vintage artwork featuring an anthropomorphic squirrel wearing round glasses, sitting relaxed in a flooded wooden cabin while enjoying a hot dog and a steamy cup of coffee. Beside the squirrel, a rustic countertop displays a coffee roasting machine, a basket of hot dogs, and jars labeled Squirrel's Stash and Acorn Relish. A scenic window view reveals a peaceful country cottage set against evergreen trees and rolling hills. Enclosed in an ornate botanical frame with acorns, coffee beans, and paw prints, this graphic brings a funny, cozy storybook charm to any apparel or merchandise collection.",
    "background_color": "#000000",
    "is_mature": "No",
    "is_public": "Public",
    "enable_all_products": "Yes"
  },
  {
    "image_filename": "cozy_whale_drinking_fresh_coffee_vintage_nautical_coastal_cabin_design.png",
    "title": "Cozy Whale Drinking Fresh Coffee Vintage Nautical Coastal Cabin Design",
    "main_tag": "coffee whale",
    "supporting_tags": [
      "nautical coffee",
      "cozy ocean aesthetic",
      "vintage coffee lover",
      "sea creature t-shirt",
      "coastal cabin design",
      "coffee roaster graphic",
      "lighthouse ocean view",
      "funny coffee lover gift",
      "whale drinking coffee",
      "vintage coffee shop illustration"
    ],
    "tags": [
      "coffee whale",
      "nautical coffee",
      "cozy ocean aesthetic",
      "vintage coffee lover",
      "sea creature t-shirt",
      "coastal cabin design",
      "coffee roaster graphic",
      "lighthouse ocean view",
      "funny coffee lover gift",
      "whale drinking coffee",
      "vintage coffee shop illustration"
    ],
    "description": "An ornate vintage style scene depicts a distinguished whale wearing glasses inside a flooded rustic cabin while holding a steaming mug of hot coffee. The warm wooden interior is filled with coffee beans, brewing machines, and books alongside a large window overlooking a coastal lighthouse at sunset. A decorative circular frame adorned with coffee leaves and cherries encircles this charming nautical aesthetic. Perfect for coffee lovers, sea enthusiasts, and unique apparel prints.",
    "background_color": "#000000",
    "is_mature": "No",
    "is_public": "Public",
    "enable_all_products": "Yes"
  },
  {
    "image_filename": "cute_hamster_explorer_african_savanna_safari_adventure_graphic_design.png",
    "title": "Cute Hamster Explorer African Savanna Safari Adventure Graphic Design",
    "main_tag": "cute hamster explorer",
    "supporting_tags": [
      "savanna safari adventure",
      "african wildlife graphic",
      "cute animal explorer",
      "hamster safari shirt",
      "elephant giraffe meerkats",
      "funny hamster design",
      "wilderness safari tour",
      "wild animal adventure",
      "kids safari graphic",
      "cute safari merch",
      "nature lover design",
      "whimsical animal illustration"
    ],
    "tags": [
      "cute hamster explorer",
      "savanna safari adventure",
      "african wildlife graphic",
      "cute animal explorer",
      "hamster safari shirt",
      "elephant giraffe meerkats",
      "funny hamster design",
      "wilderness safari tour",
      "wild animal adventure",
      "kids safari graphic",
      "cute safari merch",
      "nature lover design",
      "whimsical animal illustration"
    ],
    "description": "A cute hamster wearing a backpack and holding a magnifying glass embarks on a whimsical savanna safari adventure. Surrounding the adventurous tiny explorer are friendly wild animals, including an elephant interacting with a butterfly, a giraffe peeking through the foliage, curious meerkats, and a friendly crocodile in a pond. Set under a bright sunny sky with tall acacia trees and golden grass, this charming scene makes a delightful shirt graphic for wildlife enthusiasts.",
    "background_color": "#000000",
    "is_mature": "No",
    "is_public": "Public",
    "enable_all_products": "Yes"
  },
  {
    "image_filename": "golden_retriever_coffee_lover_cozy_flooded_cafe_vintage_design.png",
    "title": "Golden Retriever Coffee Lover Cozy Flooded Cafe Vintage Design",
    "main_tag": "golden retriever coffee lover",
    "supporting_tags": [
      "funny dog coffee lover",
      "golden retriever wearing glasses",
      "cozy flooded cafe design",
      "dog owner gift merch",
      "vintage coffee house dog",
      "cute retriever with coffee mug",
      "morning coffee dog graphic",
      "retro pet lover t-shirt",
      "canine coffee roaster art",
      "flooded cabin coffee break",
      "golden retriever illustration"
    ],
    "tags": [
      "golden retriever coffee lover",
      "funny dog coffee lover",
      "golden retriever wearing glasses",
      "cozy flooded cafe design",
      "dog owner gift merch",
      "vintage coffee house dog",
      "cute retriever with coffee mug",
      "morning coffee dog graphic",
      "retro pet lover t-shirt",
      "canine coffee roaster art",
      "flooded cabin coffee break",
      "golden retriever illustration"
    ],
    "description": "A charming retro-style artwork depicting a cheerful Golden Retriever wearing round spectacles and enjoying a steaming cup of morning coffee. The dog stands waist-deep in water inside a flooded, rustic coffee shop complete with an espresso roaster, books, and coffee bean sacks. A large window offers a beautiful view of a tranquil countryside landscape framed by a ornate floral border with paw prints. This humorous and cozy graphic illustration makes a fantastic print for t-shirts, mugs, and pet lovers merch.",
    "background_color": "#000000",
    "is_mature": "No",
    "is_public": "Public",
    "enable_all_products": "Yes"
  }
]