[
  {
    "image_filename": "cute_hamster_explorer_safari_adventure_in_african_savanna_landscape.png",
    "title": "Cute Hamster Explorer Safari Adventure In African Savanna Landscape",
    "main_tag": "cute safari hamster",
    "supporting_tags": [
      "hamster explorer",
      "african savanna animals",
      "wildlife safari merch",
      "little adventurer graphic",
      "cute animal tee design",
      "savanna adventure art",
      "funny hamster t-shirt",
      "elephant and giraffe",
      "nature explorer shirt",
      "whimsical safari journey",
      "cute animal art",
      "storybook illustration"
    ],
    "tags": [
      "cute safari hamster",
      "hamster explorer",
      "african savanna animals",
      "wildlife safari merch",
      "little adventurer graphic",
      "cute animal tee design",
      "savanna adventure art",
      "funny hamster t-shirt",
      "elephant and giraffe",
      "nature explorer shirt",
      "whimsical safari journey",
      "cute animal art",
      "storybook illustration"
    ],
    "description": "A brave little hamster explorer wearing a backpack and holding a magnifying glass walks along a sunlit trail on an exciting African safari adventure. The vibrant savanna landscape is filled with friendly wildlife, including a tall giraffe, an elephant playing with a butterfly, meerkats on a stump, and a happy crocodile resting by a waterhole. Golden grasslands, an acacia tree with a cozy hammock, and bright blooming aloe flowers complete this cheerful scene under a warm sun. Perfect for kids, animal lovers, and outdoor adventure merchandise designs.",
    "background_color": "#000000",
    "is_mature": "No",
    "is_public": "Public",
    "enable_all_products": "Yes"
  }
]