[
  {
    "image_filename": "vintage_cozy_whale_drinking_coffee_in_coastal_cafe_design.png",
    "title": "Vintage Cozy Whale Drinking Coffee in Coastal Cafe Design",
    "main_tag": "vintage coffee whale",
    "supporting_tags": [
      "whale drinking coffee",
      "cozy coffee shop art",
      "ocean aesthetic t-shirt",
      "coffee lover gift",
      "humpback whale coffee",
      "nautical coffee house",
      "retro sea creature design",
      "coffee roaster graphic",
      "lighthouse sea view",
      "whimsical animal art",
      "vintage cafe aesthetic",
      "coffee addict merch",
      "retro coffee illustration"
    ],
    "tags": [
      "vintage coffee whale",
      "whale drinking coffee",
      "cozy coffee shop art",
      "ocean aesthetic t-shirt",
      "coffee lover gift",
      "humpback whale coffee",
      "nautical coffee house",
      "retro sea creature design",
      "coffee roaster graphic",
      "lighthouse sea view",
      "whimsical animal art",
      "vintage cafe aesthetic",
      "coffee addict merch",
      "retro coffee illustration"
    ],
    "description": "A charming vintage-style artwork depicts a suave humpback whale wearing a monocle, emerging from flooded waters inside a cozy wooden coffee shop. The whale holds a steaming mug of coffee featuring a wave motif, surrounded by coffee bean sacks, vintage espresso machinery, and bookshelves. Through the large seaside window, a peaceful sunset casts a warm glow over a serene ocean with a distant lighthouse. Surrounded by an ornate frame decorated with coffee cherries and botanical leaves, this whimsical design is perfect for coffee lovers and nautical aesthetic apparel.",
    "background_color": "#000000",
    "is_mature": "No",
    "is_public": "Public",
    "enable_all_products": "Yes"
  }
]